{"$schema":"schemas/universal-census-summary-v1.schema.json","checks":[{"backend_id":"dsatur-iterative-v1","check_id":"dsatur-delta-plus-2","description":"Replayable DSATUR witness check with Delta(G)+2 colors for every canonical equitable partition.","palette_offset":1},{"backend_id":"dsatur-iterative-v1","check_id":"dsatur-delta-plus-3","description":"Replayable DSATUR witness check with Delta(G)+3 colors for every canonical equitable partition.","palette_offset":2},{"backend_id":"static-order-iterative-v1","check_id":"static-delta-plus-2","description":"Replayable static-order witness check with Delta(G)+2 colors for every canonical equitable partition.","palette_offset":1}],"claims":[{"claim_id":"UAUX-BOUND","claim_type":"finite_bound","finite_scope":"Only the complete unrestricted nauty-geng streams for the declared orders 1, 2, 3, 4, 5, 6, 7, 8, filtered by 2*Delta(G) >= n, with every canonical equitable (Delta(G)+1)-class partition subjected to the three declared positive-witness checks.","limitations":["The finite census is computational evidence and does not establish an unbounded theorem.","Generator completeness is assumed for the hash-pinned nauty-geng executable."],"orders":[1,2,3,4,5,6,7,8],"required_checks":["dsatur-delta-plus-2","dsatur-delta-plus-3","static-delta-plus-2"],"status":"verified_in_finite_scope"}],"configuration":{"checkpoint_interval":1,"search_limits":{"max_nodes_per_check":null,"timeout_seconds_per_check":null}},"created_utc":"2026-07-14T17:12:49Z","generator":{"executable":"geng","name":"nauty-geng","sha256":"1b760fca10c525f983a8e576d5e4bbdc8c740dca38ca163f48ebe421032adf3e"},"limitations":["The finite census is computational evidence and does not establish an unbounded theorem.","Generator completeness is assumed for the hash-pinned nauty-geng executable."],"producer":{"commit":"61c576fba28a03a91f6a7695e21d130cd7e76f22","distribution_version":"0.1.0","python_implementation":"CPython","python_version":"3.13.7","repository":"https://github.com/chenle02/total-coloring-toolkit","source_sha256":"61c154914c407b8f6de1d3c0f0f374c9f478fe3bcc083890031a788c4afdb337"},"replay_archive":{"bytes":114485197,"external_artifact":"archives/universal-census-orders-01-08-v1.tar.gz","media_type":"application/gzip","sha256":"63b704c4035a06d617b000462d0a7ddd208b4024e219329f617fc464b2b53115","url":"https://github.com/chenle02/total-coloring-data/releases/download/v0.1.0/universal-census-orders-01-08-v1.tar.gz"},"runs":[{"check_evaluations":0,"counts":{"candidate_unsat":0,"error":0,"skipped":1,"unknown":0,"verified_all":0},"generator_arguments":["-q","1"],"members":{"completion":{"bytes":338,"path":"order-01/completion.json","sha256":"ad03ea403be4ef9b8cf252a37d4aeecf787b8e26fb8f2ab78ffe5646a247b7fe"},"manifest":{"bytes":1415,"path":"order-01/manifest.json","sha256":"9eb17b61e3cc36a560f11537bdaf691b01c62c6ed528401188d9a6c978afe99e"},"records":{"bytes":499,"path":"order-01/records.jsonl","sha256":"25443538ea271f240e87ed21b53553e91e001938045024520a368c85eefa94e5"}},"order":1,"partition_count":0,"record_count":1,"run_fingerprint":"bc59633d3f427479a8170dd83479166e5ad969ff8dea508fb2827892b108e5bc","shard_count":1,"shard_index":0},{"check_evaluations":3,"counts":{"candidate_unsat":0,"error":0,"skipped":1,"unknown":0,"verified_all":1},"generator_arguments":["-q","2"],"members":{"completion":{"bytes":338,"path":"order-02/completion.json","sha256":"7d7ce3d18f9146eb90cf1369e9181d434f55dcd2215cff0831bff9a5c6dc08ed"},"manifest":{"bytes":1416,"path":"order-02/manifest.json","sha256":"794753343d2f81a2db3666c333243d9f6579f1271e1d12777e7a395332d3b70b"},"records":{"bytes":2227,"path":"order-02/records.jsonl","sha256":"30ec7be8b3c07298d2118221dcd9a3b551f4556b4b1362ed4ca96a7307dc6291"}},"order":2,"partition_count":1,"record_count":2,"run_fingerprint":"ba1e1cf3b4623b43be365f36d9fc0579cc9bbdf60fd862ea8b866a5588dea55a","shard_count":1,"shard_index":0},{"check_evaluations":6,"counts":{"candidate_unsat":0,"error":0,"skipped":2,"unknown":0,"verified_all":2},"generator_arguments":["-q","3"],"members":{"completion":{"bytes":338,"path":"order-03/completion.json","sha256":"d543f96f64264d78a26fd71d6338817a558386f3c1de8bc12e28383d120c4c1d"},"manifest":{"bytes":1416,"path":"order-03/manifest.json","sha256":"48919172dc04e03ca3268600766889266b6a8c8b3a1c2bb0bb0d70fe874f52d3"},"records":{"bytes":4500,"path":"order-03/records.jsonl","sha256":"40e2fb1012615b4c626f9c245ead8ff89d38d6a509e7484fad51b9678c362a85"}},"order":3,"partition_count":2,"record_count":4,"run_fingerprint":"c550ea6919e3f632dfe41b0fc0397971608788a81ad221d718dfcceeba938077","shard_count":1,"shard_index":0},{"check_evaluations":48,"counts":{"candidate_unsat":0,"error":0,"skipped":3,"unknown":0,"verified_all":8},"generator_arguments":["-q","4"],"members":{"completion":{"bytes":339,"path":"order-04/completion.json","sha256":"cbda2648c8c489b5fb3190f9ffa50bfd78a286f531bc05680d024d197893c705"},"manifest":{"bytes":1419,"path":"order-04/manifest.json","sha256":"fa115707eb6909453e5a455a1d0fd3ca285e662c6df421f520234987dc546f27"},"records":{"bytes":25197,"path":"order-04/records.jsonl","sha256":"32ce4ae03a844343d8b5f9b95d4779d732c87fd349229fc406eab48d001870c8"}},"order":4,"partition_count":16,"record_count":11,"run_fingerprint":"6da4fb5aac80ef0c64bda6f94e64e395dc9fecdba8c3a50a40b76b2b14adb6af","shard_count":1,"shard_index":0},{"check_evaluations":207,"counts":{"candidate_unsat":0,"error":0,"skipped":11,"unknown":0,"verified_all":23},"generator_arguments":["-q","5"],"members":{"completion":{"bytes":339,"path":"order-05/completion.json","sha256":"adcd141744a73c6c2a6908255e8715b9a56958d1387c388b5d4a0e25eefe79c2"},"manifest":{"bytes":1422,"path":"order-05/manifest.json","sha256":"901b26c71923fb6bcaa917b15650f46b788877b64a84601977db2abb82f8f6f6"},"records":{"bytes":103096,"path":"order-05/records.jsonl","sha256":"21d6527961d5fbef4037ffabc3b322153773e489898d0509ff4e7ec893aab0c8"}},"order":5,"partition_count":69,"record_count":34,"run_fingerprint":"c489761cdcb6ac18618752a98dc0c62519816fd402c0de2fb5829743f7e81016","shard_count":1,"shard_index":0},{"check_evaluations":3318,"counts":{"candidate_unsat":0,"error":0,"skipped":19,"unknown":0,"verified_all":137},"generator_arguments":["-q","6"],"members":{"completion":{"bytes":340,"path":"order-06/completion.json","sha256":"c4dd483393d770a2b99c6510a1071b2495133aa2e9cc4249fe634103dc272b3b"},"manifest":{"bytes":1427,"path":"order-06/manifest.json","sha256":"22f929cf80eccfbb89488a7b143800baee4f02ed1e2b57a3ab4e546d1ecd8252"},"records":{"bytes":1462267,"path":"order-06/records.jsonl","sha256":"487967b335cfce13075deba81f1b018d55ae2635e7b400e9ac963ad3276286b0"}},"order":6,"partition_count":1106,"record_count":156,"run_fingerprint":"2d9984563294ca29b08b179a6271eeb4a55e61cb1a48f5af878a08733339cb2e","shard_count":1,"shard_index":0},{"check_evaluations":44349,"counts":{"candidate_unsat":0,"error":0,"skipped":150,"unknown":0,"verified_all":894},"generator_arguments":["-q","7"],"members":{"completion":{"bytes":341,"path":"order-07/completion.json","sha256":"4cf692f017865c6876e5f20815e6d2ecb38276ca70179ba56d926c75345e1492"},"manifest":{"bytes":1431,"path":"order-07/manifest.json","sha256":"fb638496597e55046c1a08f8ff4bc5f81ec66ec02a5394f4677866b4a4110a9d"},"records":{"bytes":19449460,"path":"order-07/records.jsonl","sha256":"c719a4cf6f96623e3ca22fd8a26006ac094ad7f2bbc42f4dc6c34c4e2a00cbc4"}},"order":7,"partition_count":14783,"record_count":1044,"run_fingerprint":"f789a81a80abc59a28d1f2bbed1cdd6d0de85f65081422a6e71eb5c545a1f7d6","shard_count":1,"shard_index":0},{"check_evaluations":1542150,"counts":{"candidate_unsat":0,"error":0,"skipped":424,"unknown":0,"verified_all":11922},"generator_arguments":["-q","8"],"members":{"completion":{"bytes":342,"path":"order-08/completion.json","sha256":"21dc7f53d11f9dd17e981e37825a4c17514642963e19aad328e50b5fbf2fab0e"},"manifest":{"bytes":1436,"path":"order-08/manifest.json","sha256":"36385991ed99ccd5a476b897817b50f37b3429b05366866d52bdc5575184b4ea"},"records":{"bytes":676792316,"path":"order-08/records.jsonl","sha256":"6b741f3a4fff4b50b408027cdb9cc1a3401e9bd6d780f54112437248018d72cb"}},"order":8,"partition_count":514050,"record_count":12346,"run_fingerprint":"8e1322b4d99f6b7be10adaedfe06d19d3fafefed195937b1397b531efb3f2cc0","shard_count":1,"shard_index":0}],"schema_version":"total-coloring.universal-census-summary.v1","scope":{"connected":false,"fix_distinguished_colors":true,"graph_family":"finite_simple_unlabeled_graphs","max_degree":null,"min_degree":null,"objective":"universal_auxiliary_extension","partition_enumerator":"complement-matchings-lexicographic-v1","require_high_degree":true},"summary_id":"universal-census-orders-1-8","totals":{"check_evaluations":1590081,"counts":{"candidate_unsat":0,"error":0,"skipped":611,"unknown":0,"verified_all":12987},"order_count":8,"partition_count":530027,"record_count":13598}}
